Категория;Сложность;Вопрос;Варианты_ответов
Искусство;Легкий;Кто написал «Мона Лизу»?;[Леонардо да Винчи, Микеланджело, Рафаэль, Донателло]
Искусство;Легкий;В каком музее находится «Мона Лиза»?;[Лувр, Эрмитаж, Метрополитен, Прадо]
Искусство;Средний;Кто написал «Ночь над звёздным небом»?;[Ван Гог, Пикассо, Дали, Моне]
Искусство;Средний;В каком стиле работал Пикассо?;[Кубизм, Реализм, Импрессионизм, Романтизм]
Искусство;Сложный;Кто написал «Четыре времени года»?;[Вивальди, Бах, Моцарт, Бетховен]
Искусство;Сложный;Где находится Сикстинская капелла?;[Ватикан, Флоренция, Рим, Венеция]
География;Легкий;Самый большой океан?;[Тихий, Атлантический, Индийский, Северный Ледовитый]
География;Легкий;Столица России?;[Москва, Санкт-Петербург, Казань, Новосибирск]
География;Средний;Самая длинная река в России?;[Лена, Енисей, Обь, Амур]
География;Средний;Какая страна самая большая по площади?;[Россия, Канада, Китай, США]
География;Сложный;Самая высокая гора в мире?;[Эверест, К2, Килиманджаро, Эльбрус]
География;Сложный;Какая страна имеет форму сапога?;[Италия, Испания, Греция, Португалия]
Технологии;Легкий;Что означает аббревиатура WWW?;[World Wide Web, World Web Wide, Wide World Web, Web World Wide]
Технологии;Легкий;Кто основал Microsoft?;[Билл Гейтс, Стив Джобс, Илон Маск, Марк Цукерберг]
Технологии;Средний;Какая операционная система от Apple?;[iOS, Android, Windows, Linux]
Технологии;Средний;Что означает HTML?;[HyperText Markup Language, HighText Machine Language, HyperText Machine Language, HyperTool Markup Language]
Технологии;Сложный;Кто изобрел World Wide Web?;[Тим Бернерс-Ли, Билл Гейтс, Стив Джобс, Винт Серф]
Технологии;Сложный;Какой чип используется в iPhone?;[A-серия, Snapdragon, Exynos, Kirin]
Общая эрудиция;Легкий;Столица Франции?;[Париж, Лондон, Берлин, Рим]
Общая эрудиция;Легкий;Сколько цветов в радуге?;[7, 6, 8, 5]
Общая эрудиция;Легкий;Какая планета третья от Солнца?;[Земля, Марс, Венера, Юпитер]
Общая эрудиция;Легкий;Сколько дней в високосном году?;[366, 365, 364, 367]
Общая эрудиция;Легкий;Какой континент самый большой?;[Азия, Африка, Европа, Америка]
Общая эрудиция;Средний;Кто написал «Войну и мир»?;[Лев Толстой, Достоевский, Пушкин, Чехов]
Общая эрудиция;Средний;В каком году началась Вторая мировая война?;[1939, 1941, 1945, 1938]
Общая эрудиция;Средний;Какая страна имеет форму сапога?;[Италия, Испания, Греция, Португалия]
Общая эрудиция;Средний;Сколько материков на Земле?;[6, 5, 7, 4]
Общая эрудиция;Средний;Какой океан самый большой?;[Тихий, Атлантический, Индийский, Северный Ледовитый]
Общая эрудиция;Сложный;Самая длинная река в мире?;[Амазонка, Нил, Янцзы, Миссисипи]
Общая эрудиция;Сложный;Кто открыл пенициллин?;[Александр Флеминг, Луи Пастер, Роберт Кох, Илья Мечников]
Общая эрудиция;Сложный;Какая самая высокая гора в мире?;[Эверест, К2, Килиманджаро, Эльбрус]
Общая эрудиция;Сложный;В каком году человек впервые ступил на Луну?;[1969, 1967, 1971, 1965]
Общая эрудиция;Сложный;Сколько элементов в периодической таблице Менделеева?;[118, 100, 120, 115]
Математика;Легкий;Сколько будет 7 + 8?;[15, 13, 5, 52]
Математика;Легкий;Квадратный корень из 144?;[12, 14, 10, 16]
Математика;Легкий;Сколько градусов в прямом угле?;[90, 180, 45, 60]
Математика;Легкий;Сколько будет 15 + 27?;[42, 40, 44, 38]
Математика;Легкий;Чему равно 100 / 4?;[25, 20, 30, 15]
Математика;Средний;Сумма углов треугольника?;[180°, 360°, 90°, 270°]
Математика;Средний;Число Пи примерно равно?;[3.14, 3.16, 3.12, 3.18]
Математика;Средний;Сколько сантиметров в одном метре?;[100, 10, 1000, 50]
Математика;Средний;Квадрат числа 9?;[81, 72, 90, 63]
Математика;Средний;Сколько будет 12 ? 12?;[144, 124, 164, 134]
Математика;Сложный;Кто изобрел интегральное исчисление?;[Ньютон и Лейбниц, Эйлер, Гаусс, Ферма]
Математика;Сложный;Какое число называют «числом Эйлера»?;[2.718, 1.618, 3.141, 2.302]
Математика;Сложный;Сколько будет 5! (факториал)?;[120, 130, 100, 24]
Математика;Сложный;Сколько будет 7! (факториал)?;[5040, 720, 40320, 10080]
Математика;Сложный;Теорема Пифагора?;[a? + b? = c?, a + b = c, a ? b = c, a ? b = c]
Наука;Легкий;Химическая формула воды?;[H?O, CO?, O?, H?]
Наука;Легкий;Какой газ мы вдыхаем?;[Кислород, Азот, Углекислый газ, Водород]
Наука;Легкий;Сколько планет в Солнечной системе?;[8, 9, 7, 10]
Наука;Легкий;Какая планета красная?;[Марс, Венера, Юпитер, Сатурн]
Наука;Легкий;Сколько ног у паука?;[8, 6, 4, 10]
Наука;Средний;Скорость света в вакууме?;[300000 км/с, 150000 км/с, 450000 км/с, 200000 км/с]
Наука;Средний;Какая планета самая горячая?;[Венера, Меркурий, Марс, Юпитер]
Наука;Средний;Сколько хромосом у человека?;[46, 23, 48, 44]
Наука;Средний;Какая клетка самая большая?;[Яйцеклетка, Нейрон, Эритроцит, Лейкоцит]
Наука;Средний;Сколько сердец у осьминога?;[3, 2, 4, 1]
Наука;Сложный;Кто предложил модель атома с ядром?;[Резерфорд, Бор, Томсон, Демокрит]
Наука;Сложный;Какой элемент имеет атомный номер 1?;[Водород, Гелий, Литий, Углерод]
Наука;Сложный;Кто открыл структуру ДНК?;[Уотсон и Крик, Мендель, Дарвин, Мечников]
Наука;Сложный;Как называется процесс деления клетки?;[Митоз, Мейоз, Фагоцитоз, Осмос]
Наука;Сложный;Какой металл жидкий при комнатной температуре?;[Ртуть, Свинец, Олово, Цинк]
История;Легкий;Кто первый полетел в космос?;[Юрий Гагарин, Нил Армстронг, Алексей Леонов, Герман Титов]
История;Легкий;В каком году распался СССР?;[1991, 1989, 1993, 1985]
История;Легкий;Кто был первым президентом США?;[Джордж Вашингтон, Томас Джефферсон, Авраам Линкольн, Джон Адамс]
История;Легкий;В каком году произошло Крещение Руси?;[988, 954, 1054, 1000]
История;Легкий;Кто основал династию Романовых?;[Михаил Фёдорович, Пётр I, Николай I, Александр I]
История;Средний;В каком году началась Первая мировая война?;[1914, 1917, 1918, 1912]
История;Средний;В каком году закончилась Вторая мировая война?;[1945, 1941, 1943, 1947]
История;Средний;Кто был первым президентом России?;[Борис Ельцин, Владимир Путин, Дмитрий Медведев, Михаил Горбачёв]
История;Средний;В каком году образована ООН?;[1945, 1939, 1950, 1942]
История;Средний;Кто открыл Америку?;[Христофор Колумб, Фернан Магеллан, Джеймс Кук, Васко да Гама]
История;Сложный;В каком году началась Великая французская революция?;[1789, 1776, 1799, 1804]
История;Сложный;Кто был первым императором Рима?;[Октавиан Август, Юлий Цезарь, Нерон, Каллигула]
История;Сложный;В каком году пала Византийская империя?;[1453, 1492, 1204, 1380]
История;Сложный;Кто был первым канцлером Германии?;[Отто фон Бисмарк, Вильгельм II, Гитлер, Шрёдер]
История;Сложный;В каком году началась Холодная война?;[1947, 1945, 1950, 1960]
Литература;Легкий;Кто автор «Гарри Поттера»?;[Дж. К. Роулинг, Стивен Кинг, Джордж Мартин, Джоан Роулинг]
Литература;Легкий;Сколько томов в «Властелине колец»?;[3, 4, 5, 2]
Литература;Легкий;Кто написал «Преступление и наказание»?;[Достоевский, Толстой, Чехов, Гоголь]
Литература;Легкий;Кто написал «Мастер и Маргарита»?;[Михаил Булгаков, Александр Блок, Андрей Белый, Владимир Набоков]
Литература;Легкий;Кто написал «Войну и мир»?;[Лев Толстой, Фёдор Достоевский, Антон Чехов, Иван Тургенев]
Литература;Средний;Кто написал «Анну Каренину»?;[Лев Толстой, Фёдор Достоевский, Антон Чехов, Иван Тургенев]
Литература;Средний;Кто написал «Божественную комедию»?;[Данте, Петрарка, Боккаччо, Гомер]
Литература;Средний;Кто написал «Гамлета»?;[Уильям Шекспир, Кристофер Марло, Джон Милтон, Джон Донн]
Литература;Средний;Кто написал «1984»?;[Джордж Оруэлл, Рэй Брэдбери, Герберт Уэллс, Айзек Азимов]
Литература;Средний;Кто написал «Великий Гэтсби»?;[Фрэнсис Скотт Фицджеральд, Эрнест Хемингуэй, Джон Стейнбек, Уильям Фолкнер]
Литература;Сложный;Кто написал «Братья Карамазовы»?;[Фёдор Достоевский, Лев Толстой, Антон Чехов, Иван Тургенев]
Литература;Сложный;Кто написал «Мёртвые души»?;[Николай Гоголь, Михаил Булгаков, Александр Пушкин, Иван Тургенев]
Литература;Сложный;Кто написал «Войну миров»?;[Герберт Уэллс, Рэй Брэдбери, Артур Кларк, Айзек Азимов]
Литература;Сложный;Кто написал «Портрет Дориана Грея»?;[Оскар Уайльд, Артур Конан Дойл, Редьярд Киплинг, Томас Харди]
Литература;Сложный;Кто написал «Улисс»?;[Джеймс Джойс, Вирджиния Вулф, Т. С. Элиот, Д. Х. Лоуренс]
Музыка;Легкий;Сколько струн у гитары?;[6, 5, 7, 4]
Музыка;Легкий;Какой инструмент имеет клавиши?;[Фортепиано, Скрипка, Гитара, Труба]
Музыка;Легкий;Кто написал «Лунную сонату»?;[Бетховен, Моцарт, Бах, Шопен]
Музыка;Легкий;Сколько нот в диатонической гамме?;[7, 8, 6, 5]
Музыка;Легкий;Какой инструмент самый большой в оркестре?;[Контрабас, Виолончель, Скрипка, Флейта]
Музыка;Средний;Кто основал группу The Beatles?;[Джон Леннон, Пол Маккартни, Джордж Харрисон, Ринго Старр]
Музыка;Средний;В каком году вышел альбом «Thriller» Майкла Джексона?;[1982, 1985, 1980, 1988]
Музыка;Средний;Кто написал «Четыре времени года»?;[Вивальди, Бах, Моцарт, Бетховен]
Музыка;Средний;Сколько голосов в оперном квартете?;[4, 3, 5, 2]
Музыка;Средний;Какой музыкальный инструмент называется «король инструментов»?;[Орган, Фортепиано, Скрипка, Труба]
Музыка;Сложный;Кто написал симфонию №9 «Хоровая»?;[Бетховен, Моцарт, Брамс, Шуберт]
Музыка;Сложный;Кто написал «Времена года»?;[Вивальди, Бах, Гендель, Перголези]
Музыка;Сложный;Кто написал «Клятвопреступление»?;[Джузеппе Верди, Джакомо Пуччини, Риккардо Зандонаи, Амилкаре Понкьелли]
Музыка;Сложный;Кто написал «Свадьбу Фигаро»?;[Моцарт, Гайдн, Бетховен, Шуберт]
Музыка;Сложный;Кто написал «Кармен»?;[Жорж Бизе, Шарль Гуно, Джакомо Пуччини, Рихард Вагнер]
Кино;Легкий;Кто сыграл Джека в «Титанике»?;[Леонардо Ди Каприо, Брэд Питт, Том Круз, Джонни Депп]
Кино;Легкий;Как называется первая часть «Звёздных войн»?;[Эпизод IV, Эпизод I, Эпизод II, Эпизод III]
Кино;Легкий;Кто режиссёр «Крёстного отца»?;[Фрэнсис Форд Коппола, Стивен Спилберг, Мартин Скорсезе, Квентин Тарантино]
Кино;Легкий;Сколько «Оскаров» получил «Титаник»?;[11, 10, 9, 12]
Кино;Легкий;Кто снял фильм «Криминальное чтиво»?;[Квентин Тарантино, Гай Ричи, Дэвид Финчер, Райан Джонсон]
Кино;Средний;В каком году вышел первый «Звёздный путь» фильм?;[1979, 1975, 1982, 1985]
Кино;Средний;Кто сыграл Гарри Поттера в фильмах?;[Дэниел Рэдклифф, Руперт Гринт, Том Фелтон, Эмма Уотсон]
Кино;Средний;Кто режиссёр фильма «Начало»?;[Кристофер Нолан, Джеймс Кэмерон, Питер Джексон, Джордж Лукас]
Кино;Средний;В каком году вышел первый фильм «Матрица»?;[1999, 1997, 2001, 1995]
Кино;Средний;Кто сыграл Железного человека?;[Роберт Дауни мл., Крис Эванс, Марк Руффало, Крис Хемсворт]
Кино;Сложный;Кто снял фильм «Апокалипсис сегодня»?;[Фрэнсис Форд Коппола, Стивен Спилберг, Джордж Лукас, Мартин Скорсезе]
Кино;Сложный;Кто снял фильм «2001 год: Космическая одиссея»?;[Стэнли Кубрик, Альфред Хичкок, Фрэнсис Форд Коппола, Стивен Спилберг]
Кино;Сложный;Кто снял фильм «Паразиты»?;[Пон Джун-хо, Акира Куросава, Ким Ки Дук, Ли Чхан Дон]
Кино;Сложный;Кто снял фильм «Бойцовский клуб»?;[Дэвид Финчер, Тодд Филд, Терри Гиллиам, Майкл Бэй]
Кино;Сложный;Кто снял фильм «Сияние»?;[Стэнли Кубрик, Альфред Хичкок, Уильям Фридкин, Джордж Ромеро]
Игры;Легкий;Как называется игра про злых птиц?;[Angry Birds, Candy Crush, Clash of Clans, Pokemon GO]
Игры;Легкий;Сколько игроков в Minecraft?;[Бесконечно, 10, 50, 100]
Игры;Легкий;Кто создал серию игр «The Legend of Zelda»?;[Нинтендо, Sony, Microsoft, EA]
Игры;Легкий;В каком году вышел первый «Grand Theft Auto»?;[1997, 1995, 2000, 1998]
Игры;Легкий;Как называется игра про выживание с крафтом?;[Minecraft, Terraria, Subnautica, Rust]
Игры;Средний;Кто разрабатывает серию «The Witcher»?;[CD Projekt Red, Ubisoft, Bethesda, BioWare]
Игры;Средний;Как называется игра про супергероев от Rockstar?;[Red Dead Redemption, GTA, Max Payne, Bully]
Игры;Средний;Кто создал игру «Doom»?;[id Software, Epic Games, Valve, Bungie]
Игры;Средний;Как называется игра про шахты и сокровища?;[Minecraft, Terraria, Don't Starve, Factorio]
Игры;Средний;В каком году вышла игра «The Last of Us»?;[2013, 2015, 2010, 2018]
Игры;Сложный;Кто создал игру «Minecraft»?;[Маркус Перссон, Нотч, Джефф, Крис]
Игры;Сложный;Как называется игра про космические сражения от Microsoft?;[Halo, Gears of War, Fable, Age of Empires]
Игры;Сложный;Кто создал игру «Dark Souls»?;[FromSoftware, Capcom, Konami, Square Enix]
Игры;Сложный;Как называется игра про выживание в постапокалипсисе?;[Fallout, The Elder Scrolls, Skyrim, Oblivion]
Игры;Сложный;Кто создал игру «Half-Life»?;[Valve, Epic Games, id Software, BioWare]
Кулинария;Легкий;Из чего делают суши?;[Рис, Паста, Картофель, Баклажан]
Кулинария;Легкий;Какой фрукт используется для бананового хлеба?;[Банан, Яблоко, Груша, Апельсин]
Кулинария;Легкий;Что такое паста карбонара?;[Макароны с беконом и яйцом, Паста с томатным соусом, Паста с грибами, Паста с креветками]
Кулинария;Легкий;Какая специя придаёт жёлтый цвет рису?;[Шафран, Куркума, Паприка, Карри]
Кулинария;Легкий;Что такое суфле?;[Воздушный десерт, Суп, Салат, Мясо]
Кулинария;Средний;Какой сыр используется для пиццы Маргарита?;[Моцарелла, Пармезан, Чеддер, Гауда]
Кулинария;Средний;Из чего делают хумус?;[Нут, Фасоль, Чечевица, Горох]
Кулинария;Средний;Что такое тако?;[Мексиканское блюдо, Китайское блюдо, Индийское блюдо, Японское блюдо]
Кулинария;Средний;Какая рыба используется для сашими?;[Сырая рыба, Варёная рыба, Жареная рыба, Копчёная рыба]
Кулинария;Средний;Что такое ризотто?;[Итальянское блюдо из риса, Французское блюдо из картофеля, Испанское блюдо из пасты, Немецкое блюдо из мяса]
Кулинария;Сложный;Как называется японское блюдо из сырой рыбы?;[Сашими, Суши, Рамен, Темпура]
Кулинария;Сложный;Что такое фо-бо?;[Вьетнамский суп, Китайский суп, Японский суп, Корейский суп]
Кулинария;Сложный;Какой ингредиент используется для тирамису?;[Маскарпоне, Рикотта, Пармезан, Моцарелла]
Кулинария;Сложный;Что такое гуакамоле?;[Соус из авокадо, Соус из томатов, Соус из чеснока, Соус из перца]
Кулинария;Сложный;Как называется французский пирог с заварным кремом?;[Квеш, Тарт, Пон, Круассан]
Животные;Легкий;Сколько ног у паука?;[8, 6, 4, 10]
Животные;Легкий;Какой зверь самый быстрый?;[Гепард, Лев, Тигр, Леопард]
Животные;Легкий;Какая птица не умеет летать?;[Страус, Орёл, Сокол, Воробей]
Животные;Легкий;Сколько сердец у осьминога?;[3, 2, 4, 1]
Животные;Легкий;Какой зверь спит стоя?;[Лошадь, Корова, Свинья, Коза]
Животные;Средний;Какое животное имеет самый большой мозг?;[Кит, Слон, Человек, Дельфин]
Животные;Средний;Какая птица самая большая?;[Страус, Пингвин, Орёл, Аист]
Животные;Средний;Сколько ног у краба?;[10, 8, 6, 12]
Животные;Средний;Какое животное самое высокое?;[Жираф, Слон, Лошадь, Олень]
Животные;Средний;Какая рыба самая большая?;[Китовая акула, Белая акула, Тунец, Лосось]
Животные;Сложный;Какое животное имеет самый большой мозг у беспозвоночных?;[Осьминог, Слон, Кит, Дельфин]
Животные;Сложный;Какая змея самая ядовитая?;[Тайпан, Кобра, Гремучая змея, Анаконда]
Животные;Сложный;Какое животное самое медленное?;[Ленивец, Черепаха, Улитка, Двухпалый ленивец]
Животные;Сложный;Сколько зубов у акул за всю жизнь?;[30000, 10000, 5000, 15000]
Животные;Сложный;Какое животное может жить без воды дольше всех?;[Верблюд, Тушканчик, Крыса, Мышь]
Космос;Легкий;Сколько планет в Солнечной системе?;[8, 9, 7, 10]
Космос;Легкий;Какая планета красная?;[Марс, Венера, Юпитер, Сатурн]
Космос;Легкий;Что такое чёрная дыра?;[Область с сильной гравитацией, Звезда, Планета, Галактика]
Космос;Легкий;Сколько времени свету от Солнца до Земли?;[8 минут, 5 минут, 10 минут, 15 минут]
