Категория;Сложность;Вопрос;Варианты_ответов
География;Легкий;Столица Испании?;[Мадрид, Барселона, Севилья, Валенсия]
География;Легкий;Столица Италии?;[Рим, Милан, Неаполь, Турин]
География;Легкий;Столица Великобритании?;[Лондон, Манчестер, Бирмингем, Ливерпуль]
География;Легкий;Столица Китая?;[Пекин, Шанхай, Гуанчжоу, Шэньчжэнь]
География;Легкий;Столица Индии?;[Дели, Мумбаи, Калькутта, Бангалор]
География;Средний;Самая длинная река в Европе?;[Волга, Дунай, Рейн, Эльба]
География;Средний;Самая высокая гора в Европе?;[Эльбрус, Монблан, Килиманджаро, Эверест]
География;Средний;Самое большое озеро в мире?;[Каспийское море, Байкал, Верхнее, Виктория]
География;Средний;Самое глубокое озеро в мире?;[Байкал, Танганьика, Верхнее, Виктория]
География;Средний;Самый большой материк?;[Евразия, Африка, Северная Америка, Южная Америка]
География;Сложный;Самый маленький материк?;[Австралия, Антарктида, Южная Америка, Африка]
География;Сложный;Самый большой архипелаг в мире?;[Индонезия, Филиппины, Япония, Греция]
География;Сложный;Самый длинный тоннель в мире?;[Готард, Ла-Манш, Сёё, Акира]
География;Сложный;Самый большой город по населению?;[Токио, Нью-Йорк, Шанхай, Дели]
География;Сложный;Самая большая пустыня в мире?;[Антарктида, Сахара, Гоби, Атакама]
История;Легкий;Кто был первым царём Руси?;[Игорь, Олег, Рюрик, Святослав]
История;Легкий;Кто был первым императором России?;[Пётр I, Иван Грозный, Екатерина II, Николай I]
История;Легкий;В каком году была отмена крепостного права?;[1861, 1855, 1870, 1881]
История;Легкий;Кто был первым царём династии Романовых?;[Михаил Фёдорович, Пётр I, Николай I, Александр I]
История;Легкий;В каком году началась Отечественная война 1812 года?;[1812, 1805, 1814, 1820]
История;Средний;Кто был первым президентом России?;[Борис Ельцин, Владимир Путин, Дмитрий Медведев, Михаил Горбачёв]
История;Средний;В каком году была провозглашена Российская Федерация?;[1991, 1989, 1993, 1985]
История;Средний;Кто был первым космонавтом?;[Юрий Гагарин, Алексей Леонов, Нил Армстронг, Герман Титов]
История;Средний;В каком году началась Гражданская война в России?;[1917, 1918, 1920, 1922]
История;Средний;Кто был первым канцлером Германии?;[Отто фон Бисмарк, Вильгельм II, Гитлер, Шрёдер]
История;Сложный;В каком году была основана Москва?;[1147, 1150, 1200, 1250]
История;Сложный;Кто был первым великим князем Киевской Руси?;[Рюрик, Олег, Игорь, Святослав]
История;Сложный;В каком году было Крещение Руси?;[988, 954, 1054, 1000]
История;Сложный;Кто был первым императором Византии?;[Константин I, Юстиниан I, Феодосий I, Юлиан]
История;Сложный;В каком году пала Византийская империя?;[1453, 1492, 1204, 1380]
Наука;Легкий;Что такое H2O?;[Вода, Кислород, Водород, Углекислый газ]
Наука;Легкий;Сколько планет в Солнечной системе?;[8, 9, 7, 10]
Наука;Легкий;Какой газ преобладает в атмосфере Земли?;[Азот, Кислород, Углекислый газ, Аргон]
Наука;Легкий;Сколько зубов у взрослого человека?;[32, 30, 28, 34]
Наука;Легкий;Что такое лазер?;[Усиление света, Излучение света, Поглощение света, Отражение света]
Наука;Средний;Сколько костей в теле взрослого человека?;[206, 200, 210, 215]
Наука;Средний;Какой орган вырабатывает инсулин?;[Поджелудочная железа, Печень, Почки, Сердце]
Наука;Средний;Сколько пар хромосом у человека?;[23, 46, 22, 24]
Наука;Средний;Что такое гравитация?;[Сила притяжения, Сила отталкивания, Сила трения, Сила инерции]
Наука;Средний;Какой металл самый лёгкий?;[Литий, Алюминий, Магний, Натрий]
Наука;Сложный;Кто открыл радиоактивность?;[Мария Кюри, Альберт Эйнштейн, Нильс Бор, Вернер Гейзенберг]
Наука;Сложный;Что такое чёрная дыра?;[Область с сильной гравитацией, Звезда, Планета, Галактика]
Наука;Сложный;Какая частица не имеет массы?;[Фотон, Электрон, Протон, Нейтрон]
Наука;Сложный;Что такое квант?;[Минимальная порция энергии, Максимальная порция, Средняя порция, Средняя скорость]
Наука;Сложный;Какой закон описывает электромагнитную индукцию?;[Закон Фарадея, Закон Ома, Закон Кирхгофа, Закон Ампера]
Литература;Легкий;Кто написал «Гарри Поттера»?;[Дж. К. Роулинг, Стивен Кинг, Джордж Мартин, Джоан Роулинг]
Литература;Легкий;Кто написал «Мастер и Маргарита»?;[Михаил Булгаков, Александр Блок, Андрей Белый, Владимир Набоков]
Литература;Легкий;Кто написал «Войну и мир»?;[Лев Толстой, Фёдор Достоевский, Антон Чехов, Иван Тургенев]
Литература;Легкий;Кто написал «Преступление и наказание»?;[Фёдор Достоевский, Лев Толстой, Антон Чехов, Иван Тургенев]
Литература;Легкий;Кто написал «Анну Каренину»?;[Лев Толстой, Фёдор Достоевский, Антон Чехов, Иван Тургенев]
Литература;Средний;Кто написал «Божественную комедию»?;[Данте, Петрарка, Боккаччо, Гомер]
Литература;Средний;Кто написал «Гамлета»?;[Уильям Шекспир, Кристофер Марло, Джон Милтон, Джон Донн]
Литература;Средний;Кто написал «1984»?;[Джордж Оруэлл, Рэй Брэдбери, Герберт Уэллс, Айзек Азимов]
Литература;Средний;Кто написал «Великий Гэтсби»?;[Фрэнсис Скотт Фицджеральд, Эрнест Хемингуэй, Джон Стейнбек, Уильям Фолкнер]
Литература;Средний;Кто написал «Мёртвые души»?;[Николай Гоголь, Михаил Булгаков, Александр Пушкин, Иван Тургенев]
Литература;Сложный;Кто написал «Братья Карамазовы»?;[Фёдор Достоевский, Лев Толстой, Антон Чехов, Иван Тургенев]
Литература;Сложный;Кто написал «Войну миров»?;[Герберт Уэллс, Рэй Брэдбери, Артур Кларк, Айзек Азимов]
Литература;Сложный;Кто написал «Портрет Дориана Грея»?;[Оскар Уайльд, Артур Конан Дойл, Редьярд Киплинг, Томас Харди]
Литература;Сложный;Кто написал «Улисс»?;[Джеймс Джойс, Вирджиния Вулф, Т. С. Элиот, Д. Х. Лоуренс]
Литература;Сложный;Кто написал «Сто лет одиночества»?;[Габриэль Гарсиа Маркес, Хорхе Луис Борхес, Марио Варгас Льоса, Пабло Неруда]
Музыка;Легкий;Сколько струн у скрипки?;[4, 5, 6, 3]
Музыка;Легкий;Сколько клавиш у фортепиано?;[88, 76, 96, 64]
Музыка;Легкий;Кто написал «Симфонию №5»?;[Бетховен, Моцарт, Бах, Шопен]
Музыка;Легкий;Какой инструмент называется «король инструментов»?;[Орган, Фортепиано, Скрипка, Труба]
Музыка;Легкий;Сколько голосов в хоре?;[4, 3, 5, 2]
Музыка;Средний;Кто основал группу The Beatles?;[Джон Леннон, Пол Маккартни, Джордж Харрисон, Ринго Старр]
Музыка;Средний;В каком году вышел альбом «Thriller» Майкла Джексона?;[1982, 1985, 1980, 1988]
Музыка;Средний;Кто написал «Четыре времени года»?;[Вивальди, Бах, Моцарт, Бетховен]
Музыка;Средний;Сколько голосов в оперном квартете?;[4, 3, 5, 2]
Музыка;Средний;Какой музыкальный инструмент называется «король инструментов»?;[Орган, Фортепиано, Скрипка, Труба]
Музыка;Сложный;Кто написал симфонию №9 «Хоровая»?;[Бетховен, Моцарт, Брамс, Шуберт]
Музыка;Сложный;Кто написал «Времена года»?;[Вивальди, Бах, Гендель, Перголези]
Музыка;Сложный;Кто написал «Клятвопреступление»?;[Джузеппе Верди, Джакомо Пуччини, Риккардо Зандонаи, Амилкаре Понкьелли]
Музыка;Сложный;Кто написал «Свадьбу Фигаро»?;[Моцарт, Гайдн, Бетховен, Шуберт]
Музыка;Сложный;Кто написал «Кармен»?;[Жорж Бизе, Шарль Гуно, Джакомо Пуччини, Рихард Вагнер]
Кино;Легкий;Кто сыграл Джека в «Титанике»?;[Леонардо Ди Каприо, Брэд Питт, Том Круз, Джонни Депп]
Кино;Легкий;Как называется первая часть «Звёздных войн»?;[Эпизод IV, Эпизод I, Эпизод II, Эпизод III]
Кино;Легкий;Кто режиссёр «Крёстного отца»?;[Фрэнсис Форд Коппола, Стивен Спилберг, Мартин Скорсезе, Квентин Тарантино]
Кино;Легкий;Сколько «Оскаров» получил «Титаник»?;[11, 10, 9, 12]
Кино;Легкий;Кто снял фильм «Криминальное чтиво»?;[Квентин Тарантино, Гай Ричи, Дэвид Финчер, Райан Джонсон]
Кино;Средний;В каком году вышел первый «Звёздный путь» фильм?;[1979, 1975, 1982, 1985]
Кино;Средний;Кто сыграл Гарри Поттера в фильмах?;[Дэниел Рэдклифф, Руперт Гринт, Том Фелтон, Эмма Уотсон]
Кино;Средний;Кто режиссёр фильма «Начало»?;[Кристофер Нолан, Джеймс Кэмерон, Питер Джексон, Джордж Лукас]
Кино;Средний;В каком году вышел первый фильм «Матрица»?;[1999, 1997, 2001, 1995]
Кино;Средний;Кто сыграл Железного человека?;[Роберт Дауни мл., Крис Эванс, Марк Руффало, Крис Хемсворт]
Кино;Сложный;Кто снял фильм «Апокалипсис сегодня»?;[Фрэнсис Форд Коппола, Стивен Спилберг, Джордж Лукас, Мартин Скорсезе]
Кино;Сложный;Кто снял фильм «2001 год: Космическая одиссея»?;[Стэнли Кубрик, Альфред Хичкок, Фрэнсис Форд Коппола, Стивен Спилберг]
Кино;Сложный;Кто снял фильм «Паразиты»?;[Пон Джун-хо, Акира Куросава, Ким Ки Дук, Ли Чхан Дон]
Кино;Сложный;Кто снял фильм «Бойцовский клуб»?;[Дэвид Финчер, Тодд Филд, Терри Гиллиам, Майкл Бэй]
Кино;Сложный;Кто снял фильм «Сияние»?;[Стэнли Кубрик, Альфред Хичкок, Уильям Фридкин, Джордж Ромеро]
Игры;Легкий;Как называется игра про злых птиц?;[Angry Birds, Candy Crush, Clash of Clans, Pokemon GO]
Игры;Легкий;Сколько игроков в Minecraft?;[Бесконечно, 10, 50, 100]
Игры;Легкий;Кто создал серию игр «The Legend of Zelda»?;[Нинтендо, Sony, Microsoft, EA]
Игры;Легкий;В каком году вышел первый «Grand Theft Auto»?;[1997, 1995, 2000, 1998]
Игры;Легкий;Как называется игра про выживание с крафтом?;[Minecraft, Terraria, Subnautica, Rust]
Игры;Средний;Кто разрабатывает серию «The Witcher»?;[CD Projekt Red, Ubisoft, Bethesda, BioWare]
Игры;Средний;Как называется игра про супергероев от Rockstar?;[Red Dead Redemption, GTA, Max Payne, Bully]
Игры;Средний;Кто создал игру «Doom»?;[id Software, Epic Games, Valve, Bungie]
Игры;Средний;Как называется игра про шахты и сокровища?;[Minecraft, Terraria, Don't Starve, Factorio]
Игры;Средний;В каком году вышла игра «The Last of Us»?;[2013, 2015, 2010, 2018]
Игры;Сложный;Кто создал игру «Minecraft»?;[Маркус Перссон, Нотч, Джефф, Крис]
Игры;Сложный;Как называется игра про космические сражения от Microsoft?;[Halo, Gears of War, Fable, Age of Empires]
Игры;Сложный;Кто создал игру «Dark Souls»?;[FromSoftware, Capcom, Konami, Square Enix]
Игры;Сложный;Как называется игра про выживание в постапокалипсисе?;[Fallout, The Elder Scrolls, Skyrim, Oblivion]
Игры;Сложный;Кто создал игру «Half-Life»?;[Valve, Epic Games, id Software, BioWare]
Кулинария;Легкий;Из чего делают суши?;[Рис, Паста, Картофель, Баклажан]
Кулинария;Легкий;Какой фрукт используется для бананового хлеба?;[Банан, Яблоко, Груша, Апельсин]
Кулинария;Легкий;Что такое паста карбонара?;[Макароны с беконом и яйцом, Паста с томатным соусом, Паста с грибами, Паста с креветками]
Кулинария;Легкий;Какая специя придаёт жёлтый цвет рису?;[Шафран, Куркума, Паприка, Карри]
Кулинария;Легкий;Что такое суфле?;[Воздушный десерт, Суп, Салат, Мясо]
Кулинария;Средний;Какой сыр используется для пиццы Маргарита?;[Моцарелла, Пармезан, Чеддер, Гауда]
Кулинария;Средний;Из чего делают хумус?;[Нут, Фасоль, Чечевица, Горох]
Кулинария;Средний;Что такое тако?;[Мексиканское блюдо, Китайское блюдо, Индийское блюдо, Японское блюдо]
Кулинария;Средний;Какая рыба используется для сашими?;[Сырая рыба, Варёная рыба, Жареная рыба, Копчёная рыба]
Кулинария;Средний;Что такое ризотто?;[Итальянское блюдо из риса, Французское блюдо из картофеля, Испанское блюдо из пасты, Немецкое блюдо из мяса]
Кулинария;Сложный;Как называется японское блюдо из сырой рыбы?;[Сашими, Суши, Рамен, Темпура]
Кулинария;Сложный;Что такое фо-бо?;[Вьетнамский суп, Китайский суп, Японский суп, Корейский суп]
Кулинария;Сложный;Какой ингредиент используется для тирамису?;[Маскарпоне, Рикотта, Пармезан, Моцарелла]
Кулинария;Сложный;Что такое гуакамоле?;[Соус из авокадо, Соус из томатов, Соус из чеснока, Соус из перца]
Кулинария;Сложный;Как называется французский пирог с заварным кремом?;[Квеш, Тарт, Пон, Круассан]
Животные;Легкий;Сколько ног у паука?;[8, 6, 4, 10]
Животные;Легкий;Какой зверь самый быстрый?;[Гепард, Лев, Тигр, Леопард]
Животные;Легкий;Какая птица не умеет летать?;[Страус, Орёл, Сокол, Воробей]
Животные;Легкий;Сколько сердец у осьминога?;[3, 2, 4, 1]
Животные;Легкий;Какой зверь спит стоя?;[Лошадь, Корова, Свинья, Коза]
Животные;Средний;Какое животное имеет самый большой мозг?;[Кит, Слон, Человек, Дельфин]
Животные;Средний;Какая птица самая большая?;[Страус, Пингвин, Орёл, Аист]
Животные;Средний;Сколько ног у краба?;[10, 8, 6, 12]
Животные;Средний;Какое животное самое высокое?;[Жираф, Слон, Лошадь, Олень]
Животные;Средний;Какая рыба самая большая?;[Китовая акула, Белая акула, Тунец, Лосось]
Животные;Сложный;Какое животное имеет самый большой мозг у беспозвоночных?;[Осьминог, Слон, Кит, Дельфин]
Животные;Сложный;Какая змея самая ядовитая?;[Тайпан, Кобра, Гремучая змея, Анаконда]
Животные;Сложный;Какое животное самое медленное?;[Ленивец, Черепаха, Улитка, Двухпалый ленивец]
Животные;Сложный;Сколько зубов у акул за всю жизнь?;[30000, 10000, 5000, 15000]
Животные;Сложный;Какое животное может жить без воды дольше всех?;[Верблюд, Тушканчик, Крыса, Мышь]
Космос;Легкий;Сколько планет в Солнечной системе?;[8, 9, 7, 10]
Космос;Легкий;Какая планета красная?;[Марс, Венера, Юпитер, Сатурн]
Космос;Легкий;Что такое чёрная дыра?;[Область с сильной гравитацией, Звезда, Планета, Галактика]
Космос;Легкий;Сколько времени свету от Солнца до Земли?;[8 минут, 5 минут, 10 минут, 15 минут]
Космос;Легкий;Какая галактика ближе всего к Млечному Пути?;[Андромеда, Треугольник, Сомбреро, Мессье]
Космос;Средний;Кто первый вышел в открытый космос?;[Алексей Леонов, Юрий Гагарин, Нил Армстронг, Базз Олдрин]
Космос;Средний;Какая планета самая большая?;[Юпитер, Сатурн, Уран, Нептун]
Космос;Средний;Сколько спутников у Земли?;[1, 2, 3, 4]
Космос;Средний;Какая планета имеет кольца?;[Сатурн, Юпитер, Уран, Нептун]
Космос;Средний;Что такое туманность?;[Облако газа и пыли, Звезда, Планета, Галактика]
Космос;Сложный;Кто был первым человеком в космосе?;[Юрий Гагарин, Нил Армстронг, Алексей Леонов, Герман Титов]
Космос;Сложный;Какая планета вращается «лежа на боку»?;[Уран, Нептун, Сатурн, Юпитер]
Космос;Сложный;Сколько звёзд в Млечном Пути?;[100-400 млрд, 50-100 млрд, 1-10 млрд, 1 трлн]
Космос;Сложный;Что такое пульсар?;[Нейтронная звезда, Чёрная дыра, Белый карлик, Красный гигант]
Космос;Сложный;Какая галактика столкнётся с Млечным Путём?;[Андромеда, Треугольник, Сомбреро, Мессье]
Физика;Легкий;Единица измерения силы тока?;[Ампер, Вольт, Ватт, Ом]
Физика;Легкий;Какая сила притягивает предметы к Земле?;[Гравитация, Магнетизм, Электричество, Ядерная]
Физика;Легкий;Скорость звука в воздухе?;[340 м/с, 300 м/с, 400 м/с, 250 м/с]
Физика;Легкий;Что такое масса?;[Количество вещества, Сила, Вес, Объём]
Физика;Легкий;Кто открыл закон всемирного тяготения?;[Ньютон, Эйнштейн, Галилей, Кеплер]
Физика;Средний;Какая формула E=mc??;[Энергия, Сила, Масса, Скорость]
Физика;Средний;Что такое квант?;[Минимальная порция энергии, Максимальная порция, Средняя порция, Средняя скорость]
Физика;Средний;Какой закон описывает движение тел?;[Закон Ньютона, Закон Кеплера, Закон Ома, Закон Бойля]
Физика;Средний;Что такое энтропия?;[Мера беспорядка, Мера порядка, Мера скорости, Мера массы]
Физика;Средний;Какая единица измерения мощности?;[Ватт, Джоуль, Ньютон, Паскаль]
Физика;Сложный;Кто создал теорию относительности?;[Эйнштейн, Ньютон, Галилей, Максвелл]
Физика;Сложный;Что такое кварк?;[Элементарная частица, Атом, Молекула, Ион]
Физика;Сложный;Какая частица не имеет массы?;[Фотон, Электрон, Протон, Нейтрон]
