Категория;Сложность;Вопрос;Варианты_ответов
Физика;Сложный;Что такое суперпозиция?;[Сложение волн, Разложение волн, Умножение волн, Деление волн]
Физика;Сложный;Какой закон описывает электромагнитную индукцию?;[Закон Фарадея, Закон Ома, Закон Кирхгофа, Закон Ампера]
Химия;Легкий;Какой газ поддерживает горение?;[Кислород, Азот, Водород, Углекислый]
Химия;Легкий;pH воды равен?;[7, 5, 9, 10]
Химия;Легкий;Что такое H?SO??;[Серная кислота, Соляная кислота, Азотная кислота, Угольная кислота]
Химия;Легкий;Какой металл жидкий при комнатной температуре?;[Ртуть, Свинец, Олово, Цинк]
Химия;Легкий;Кто создал периодическую таблицу?;[Менделеев, Бойль, Дальтон, Авогадро]
Химия;Средний;Сколько элементов в таблице Менделеева?;[118, 100, 120, 115]
Химия;Средний;Что такое изотоп?;[Вариант элемента, Вариант молекулы, Вариант атома, Вариант иона]
Химия;Средний;Какой газ самый лёгкий?;[Водород, Гелий, Азот, Кислород]
Химия;Средний;Что такое окисление?;[Потеря электронов, Приобретение электронов, Потеря протонов, Приобретение протонов]
Химия;Средний;Какой металл самый твёрдый?;[Хром, Железо, Медь, Алюминий]
Химия;Сложный;Кто открыл радиоактивность?;[Мария Кюри, Альберт Эйнштейн, Нильс Бор, Вернер Гейзенберг]
Химия;Сложный;Что такое аллотропия?;[Разные формы одного элемента, Разные элементы, Разные молекулы, Разные ионы]
Химия;Сложный;Какой элемент имеет символ Au?;[Золото, Серебро, Медь, Железо]
Химия;Сложный;Что такое катализатор?;[Вещество ускоряет реакцию, Вещество замедляет реакцию, Вещество не влияет, Вещество останавливает]
Химия;Сложный;Какой элемент самый электроотрицательный?;[Фтор, Хлор, Кислород, Азот]
Биология;Легкий;Сколько хромосом у человека?;[46, 23, 48, 44]
Биология;Легкий;Какая клетка самая большая?;[Яйцеклетка, Нейрон, Эритроцит, Лейкоцит]
Биология;Легкий;Что такое ДНК?;[Носитель генетической информации, Белок, Липид, Углевод]
Биология;Легкий;Сколько камер у сердца человека?;[4, 2, 3, 5]
Биология;Легкий;Кто открыл структуру ДНК?;[Уотсон и Крик, Мендель, Дарвин, Мечников]
Биология;Средний;Как называется процесс деления клетки?;[Митоз, Мейоз, Фагоцитоз, Осмос]
Биология;Средний;Какая ткань соединяет мышцы с костями?;[Сухожилие, Связка, Хрящ, Кость]
Биология;Средний;Сколько костей в теле взрослого человека?;[206, 200, 210, 215]
Биология;Средний;Какой орган фильтрует кровь?;[Почки, Печень, Сердце, Лёгкие]
Биология;Средний;Что такое фотосинтез?;[Процесс создания пищи растениями, Процесс дыхания, Процесс роста, Процесс размножения]
Биология;Сложный;Кто считается отцом генетики?;[Грегор Мендель, Чарльз Дарвин, Луи Пастер, Роберт Кох]
Биология;Сложный;Какая клетка производит антитела?;[B-лимфоциты, T-лимфоциты, Эритроциты, Тромбоциты]
Биология;Сложный;Что такое митохондрия?;[Энергетическая станция клетки, Ядро клетки, Рибосома, Лизосома]
Биология;Сложный;Какой гормон регулирует уровень сахара?;[Инсулин, Адреналин, Тестостерон, Эстроген]
Биология;Сложный;Сколько пар хромосом у человека?;[23, 46, 22, 24]
Спорт;Легкий;Сколько игроков в футбольной команде на поле?;[11, 10, 12, 9]
Спорт;Легкий;В каком виде спорта используется мяч?;[Футбол, Бокс, Плавание, Лыжи]
Спорт;Легкий;Где проходили первые Олимпийские игры?;[Афины, Рим, Париж, Лондон]
Спорт;Легкий;Сколько колец на олимпийском флаге?;[5, 6, 4, 7]
Спорт;Легкий;Кто держит рекорд по золотым медалям на Олимпиадах?;[Майкл Фелпс, Усэйн Болт, Лариса Латынина, Карл Льюис]
Спорт;Средний;В каком году Россия принимала Чемпионат мира по футболу?;[2018, 2014, 2022, 2010]
Спорт;Средний;Сколько минут в футбольном матче?;[90, 80, 100, 70]
Спорт;Средний;Какой спорт называют королём спорта?;[Футбол, Бокс, Лёгкая атлетика, Плавание]
Спорт;Средний;Где проходили Олимпийские игры 2008?;[Пекин, Лондон, Рио, Токио]
Спорт;Средний;Сколько очков за 3-очковый бросок в баскетболе?;[3, 2, 1, 4]
Спорт;Сложный;Кто держит рекорд по голам в карьере?;[Криштиану Роналду, Лионель Месси, Пеле, Марадона]
Спорт;Сложный;В каком году Россия принимала Олимпиаду?;[2014, 2018, 2012, 2016]
Спорт;Сложный;Какой вид спорта самый популярный в мире?;[Футбол, Баскетбол, Теннис, Крикет]
Спорт;Сложный;Сколько очков в теннисном сете?;[6, 5, 7, 4]
Спорт;Сложный;Кто выиграл больше всего «Золотых мячей»?;[Лионель Месси, Криштиану Роналду, Йохан Кройф, Мишель Платини]
Технологии;Легкий;Что означает аббревиатура WWW?;[World Wide Web, World Web Wide, Wide World Web, Web World Wide]
Технологии;Легкий;Кто основал Microsoft?;[Билл Гейтс, Стив Джобс, Илон Маск, Марк Цукерберг]
Технологии;Легкий;Какая операционная система от Apple?;[iOS, Android, Windows, Linux]
Технологии;Легкий;Что означает HTML?;[HyperText Markup Language, HighText Machine Language, HyperText Machine Language, HyperTool Markup Language]
Технологии;Легкий;Кто изобрел World Wide Web?;[Тим Бернерс-Ли, Билл Гейтс, Стив Джобс, Винт Серф]
Технологии;Средний;Какой чип используется в iPhone?;[A-серия, Snapdragon, Exynos, Kirin]
Технологии;Средний;Что такое блокчейн?;[Технология распределённого реестра, База данных, Облачное хранилище, Сервер]
Технологии;Средний;Какая версия Windows самая популярная?;[Windows 10, Windows 7, Windows 11, Windows XP]
Технологии;Средний;Кто изобрёл транзистор?;[Бардин, Браттейн и Шокли, Эдисон, Тесла, Маркони]
Технологии;Средний;Что означает API?;[Application Programming Interface, Advanced Programming Interface, Application Process Interface, Advanced Process Interface]
Технологии;Сложный;Кто создал язык программирования Python?;[Гвидо ван Россум, Линус Торвальдс, Бьян Струструп, Джеймс Гослинг]
Технологии;Сложный;Что означает HTTP?;[HyperText Transfer Protocol, HighText Transfer Protocol, HyperText Transmission Protocol, HighText Transmission Protocol]
Технологии;Сложный;Какая компания владеет Android?;[Google, Apple, Microsoft, Samsung]
Технологии;Сложный;Что такое облачные вычисления?;[Использование удалённых серверов, Использование локальных серверов, Использование мобильных устройств, Использование спутников]
Технологии;Сложный;Кто создал Linux?;[Линус Торвальдс, Гвидо ван Россум, Бьян Струструп, Джеймс Гослинг]
География;Легкий;Столица Японии?;[Токио, Киото, Осака, Йокогама]
География;Легкий;Самая длинная река в Африке?;[Нил, Конго, Нигер, Замбези]
География;Легкий;Самый большой остров в мире?;[Гренландия, Австралия, Новая Гвинея, Борнео]
География;Легкий;Столица Германии?;[Берлин, Мюнхен, Гамбург, Франкфурт]
География;Легкий;Сколько континентов на Земле?;[6, 5, 7, 4]
География;Средний;Самая глубокая точка океана?;[Марианская впадина, Желоб Пуэрто-Рико, Желоб Тонга, Желоб Филиппин]
География;Средний;В какой стране находится Мачу-Пикчу?;[Перу, Боливия, Чили, Эквадор]
География;Средний;Самая большая страна по площади?;[Россия, Канада, Китай, США]
География;Средний;Столица Канады?;[Оттава, Торонто, Ванкувер, Монреаль]
География;Средний;Где находится остров Пасхи?;[Тихий океан, Атлантический океан, Индийский океан, Северный Ледовитый океан]
География;Сложный;Самый высокий водопад в мире?;[Анхель, Виктория, Игуасу, Ниагарский]
География;Сложный;В какой стране находится пустыня Атакама?;[Чили, Аргентина, Перу, Боливия]
География;Сложный;Столица Австралии?;[Канберра, Сидней, Мельбурн, Брисбен]
География;Сложный;Самый большой полуостров в мире?;[Аравийский, Индостан, Скандинавский, Аляска]
География;Сложный;Какая страна имеет больше всего озёр?;[Канада, Россия, Финляндия, США]
История;Легкий;В каком году закончилась Вторая мировая война?;[1945, 1941, 1939, 1950]
История;Легкий;Кто был первым императором Китая?;[Цинь Шихуанди, Конфуций, Чанг-ди, Ван-ди]
История;Легкий;В каком году началась Великая французская революция?;[1789, 1776, 1812, 1799]
История;Легкий;Кто открыл Америку?;[Христофор Колумб, Фернан Магеллан, Джеймс Кук, Васко да Гама]
История;Легкий;В каком году была изобретена бумага?;[II век до н.э., I век до н.э., II век н.э., I век н.э.]
История;Средний;Кто построил Вавилонскую башню?;[Согласно Библии, люди, Бог, Ангелы, Демон]
История;Средний;В каком году пала Константинополь?;[1453, 1492, 1204, 1380]
История;Средний;Кто был первым императором Рима?;[Октавиан Август, Юлий Цезарь, Нерон, Каллигула]
История;Средний;В каком году началась Столетняя война?;[1337, 1453, 1214, 1066]
История;Средний;Кто был лидером Советского Союза во время Второй мировой войны?;[Иосиф Сталин, Владимир Ленин, Никита Хрущёв, Леонид Брежнев]
История;Сложный;В каком году была принята Декларация независимости США?;[1776, 1789, 1812, 1775]
История;Сложный;Кто был первым канцлером объединённой Германии?;[Отто фон Бисмарк, Вильгельм II, Гитлер, Шрёдер]
История;Сложный;В каком году произошла Революция в России?;[1917, 1905, 1922, 1914]
История;Сложный;Кто был первым императором Византии?;[Константин I, Юстиниан I, Феодосий I, Юлиан]
История;Сложный;В каком году была отменена крепостное право в России?;[1861, 1855, 1870, 1881]
Наука;Легкий;Что такое H2O?;[Вода, Кислород, Водород, Углекислый газ]
Наука;Легкий;Сколько планет в Солнечной системе?;[8, 9, 7, 10]
Наука;Легкий;Какой газ преобладает в атмосфере Земли?;[Азот, Кислород, Углекислый газ, Аргон]
Наука;Легкий;Сколько зубов у взрослого человека?;[32, 30, 28, 34]
Наука;Легкий;Что такое лазер?;[Усиление света, Излучение света, Поглощение света, Отражение света]
Наука;Средний;Сколько костей в теле взрослого человека?;[206, 200, 210, 215]
Наука;Средний;Какой орган вырабатывает инсулин?;[Поджелудочная железа, Печень, Почки, Сердце]
Наука;Средний;Сколько пар хромосом у человека?;[23, 46, 22, 24]
Наука;Средний;Что такое гравитация?;[Сила притяжения, Сила отталкивания, Сила трения, Сила инерции]
Наука;Средний;Какой металл самый лёгкий?;[Литий, Алюминий, Магний, Натрий]
Наука;Сложный;Кто открыл радиоактивность?;[Мария Кюри, Альберт Эйнштейн, Нильс Бор, Вернер Гейзенберг]
Наука;Сложный;Что такое чёрная дыра?;[Область с сильной гравитацией, Звезда, Планета, Галактика]
Наука;Сложный;Какая частица не имеет массы?;[Фотон, Электрон, Протон, Нейтрон]
Наука;Сложный;Что такое квант?;[Минимальная порция энергии, Максимальная порция, Средняя порция, Средняя скорость]
Наука;Сложный;Какой закон описывает электромагнитную индукцию?;[Закон Фарадея, Закон Ома, Закон Кирхгофа, Закон Ампера]
Литература;Легкий;Кто написал «Гарри Поттера»?;[Дж. К. Роулинг, Стивен Кинг, Джордж Мартин, Джоан Роулинг]
Литература;Легкий;Кто написал «Мастер и Маргарита»?;[Михаил Булгаков, Александр Блок, Андрей Белый, Владимир Набоков]
Литература;Легкий;Кто написал «Войну и мир»?;[Лев Толстой, Фёдор Достоевский, Антон Чехов, Иван Тургенев]
Литература;Легкий;Кто написал «Преступление и наказание»?;[Фёдор Достоевский, Лев Толстой, Антон Чехов, Иван Тургенев]
Литература;Легкий;Кто написал «Анну Каренину»?;[Лев Толстой, Фёдор Достоевский, Антон Чехов, Иван Тургенев]
Литература;Средний;Кто написал «Божественную комедию»?;[Данте, Петрарка, Боккаччо, Гомер]
Литература;Средний;Кто написал «Гамлета»?;[Уильям Шекспир, Кристофер Марло, Джон Милтон, Джон Донн]
Литература;Средний;Кто написал «1984»?;[Джордж Оруэлл, Рэй Брэдбери, Герберт Уэллс, Айзек Азимов]
Литература;Средний;Кто написал «Великий Гэтсби»?;[Фрэнсис Скотт Фицджеральд, Эрнест Хемингуэй, Джон Стейнбек, Уильям Фолкнер]
Литература;Средний;Кто написал «Мёртвые души»?;[Николай Гоголь, Михаил Булгаков, Александр Пушкин, Иван Тургенев]
Литература;Сложный;Кто написал «Братья Карамазовы»?;[Фёдор Достоевский, Лев Толстой, Антон Чехов, Иван Тургенев]
Литература;Сложный;Кто написал «Войну миров»?;[Герберт Уэллс, Рэй Брэдбери, Артур Кларк, Айзек Азимов]
Литература;Сложный;Кто написал «Портрет Дориана Грея»?;[Оскар Уайльд, Артур Конан Дойл, Редьярд Киплинг, Томас Харди]
Литература;Сложный;Кто написал «Улисс»?;[Джеймс Джойс, Вирджиния Вулф, Т. С. Элиот, Д. Х. Лоуренс]
Литература;Сложный;Кто написал «Сто лет одиночества»?;[Габриэль Гарсиа Маркес, Хорхе Луис Борхес, Марио Варгас Льоса, Пабло Неруда]
Искусство;Легкий;Кто написал «Мона Лизу»?;[Леонардо да Винчи, Микеланджело, Рафаэль, Донателло]
Искусство;Легкий;В каком музее находится «Мона Лиза»?;[Лувр, Эрмитаж, Метрополитен, Прадо]
Искусство;Легкий;Кто написал «Ночь над звёздным небом»?;[Ван Гог, Пикассо, Дали, Моне]
Искусство;Легкий;В каком стиле работал Пикассо?;[Кубизм, Реализм, Импрессионизм, Романтизм]
Искусство;Легкий;Кто написал «Четыре времени года»?;[Вивальди, Бах, Моцарт, Бетховен]
Искусство;Средний;Где находится Сикстинская капелла?;[Ватикан, Флоренция, Рим, Венеция]
Искусство;Средний;Кто написал «Девушку с жемчужной серёжкой»?;[Ян Вермеер, Рембрандт, Франс Халс, Питер Пауль Рубенс]
Искусство;Средний;Кто написал «Крик»?;[Эдвард Мунк, Густав Климт, Поль Гоген, Винсент Ван Гог]
Искусство;Средний;Кто написал «Гернику»?;[Пабло Пикассо, Сальвадор Дали, Жоан Миро, Виллем де Кунинг]
Искусство;Средний;Кто написал «Последний суд»?;[Микеланджело, Леонардо да Винчи, Рафаэль, Донателло]
Искусство;Сложный;Кто написал «Звёздную ночь над Роной»?;[Винсент Ван Гог, Поль Гоген, Клод Моне, Огюст Ренуар]
Искусство;Сложный;Кто написал «Девушку с веером»?;[Пьер Огюст Ренуар, Клод Моне, Эдуард Мане, Гюстав Курбе]
Искусство;Сложный;Кто написал «Сон»?;[Пабло Пикассо, Сальвадор Дали, Жоан Миро, Марк Шагал]
Искусство;Сложный;Кто написал «Постоянство памяти»?;[Сальвадор Дали, Рене Магритт, Макс Эрнст, Жоан Миро]
Искусство;Сложный;Кто написал «Венера Милосская»?;[Александр из Антиохии, Микеланджело, Леонардо да Винчи, Рафаэль]
Музыка;Легкий;Сколько струн у гитары?;[6, 5, 7, 4]
Музыка;Легкий;Какой инструмент имеет клавиши?;[Фортепиано, Скрипка, Гитара, Труба]
Музыка;Легкий;Кто написал «Лунную сонату»?;[Бетховен, Моцарт, Бах, Шопен]
Музыка;Легкий;Сколько нот в диатонической гамме?;[7, 8, 6, 5]
Музыка;Легкий;Какой инструмент самый большой в оркестре?;[Контрабас, Виолончель, Скрипка, Флейта]
Музыка;Средний;Кто основал группу The Beatles?;[Джон Леннон, Пол Маккартни, Джордж Харрисон, Ринго Старр]
Музыка;Средний;В каком году вышел альбом «Thriller» Майкла Джексона?;[1982, 1985, 1980, 1988]
Музыка;Средний;Кто написал «Четыре времени года»?;[Вивальди, Бах, Моцарт, Бетховен]
Музыка;Средний;Сколько голосов в оперном квартете?;[4, 3, 5, 2]
Музыка;Средний;Какой музыкальный инструмент называется «король инструментов»?;[Орган, Фортепиано, Скрипка, Труба]
Музыка;Сложный;Кто написал симфонию №9 «Хоровая»?;[Бетховен, Моцарт, Брамс, Шуберт]
Музыка;Сложный;Кто написал «Времена года»?;[Вивальди, Бах, Гендель, Перголези]
Музыка;Сложный;Кто написал «Клятвопреступление»?;[Джузеппе Верди, Джакомо Пуччини, Риккардо Зандонаи, Амилкаре Понкьелли]
Музыка;Сложный;Кто написал «Свадьбу Фигаро»?;[Моцарт, Гайдн, Бетховен, Шуберт]
Музыка;Сложный;Кто написал «Кармен»?;[Жорж Бизе, Шарль Гуно, Джакомо Пуччини, Рихард Вагнер]
Кино;Легкий;Кто сыграл Джека в «Титанике»?;[Леонардо Ди Каприо, Брэд Питт, Том Круз, Джонни Депп]
Кино;Легкий;Как называется первая часть «Звёздных войн»?;[Эпизод IV, Эпизод I, Эпизод II, Эпизод III]
Кино;Легкий;Кто режиссёр «Крёстного отца»?;[Фрэнсис Форд Коппола, Стивен Спилберг, Мартин Скорсезе, Квентин Тарантино]
Кино;Легкий;Сколько «Оскаров» получил «Титаник»?;[11, 10, 9, 12]
